{
  "$schema": "https://json-schema.org/draft/2020-12/schema",
  "$id": "https://isitusa.com/schemas/research/state-applicability.schema.json",
  "title": "Project Isitusa explicit state species applicability",
  "type": "object",
  "additionalProperties": false,
  "required": ["schemaVersion", "stateCode", "asOf", "species", "undeterminedSpeciesPolicy"],
  "properties": {
    "schemaVersion": { "const": 1 },
    "stateCode": { "type": "string", "pattern": "^[A-Z]{2}$" },
    "asOf": { "type": "string", "format": "date" },
    "undeterminedSpeciesPolicy": { "const": "excluded" },
    "species": {
      "type": "array",
      "uniqueItems": true,
      "items": {
        "type": "object",
        "additionalProperties": false,
        "required": ["speciesId", "applicability", "priority", "basis"],
        "properties": {
          "speciesId": { "type": "string", "pattern": "^[a-z0-9-]+$" },
          "applicability": { "const": "applicable" },
          "priority": { "enum": ["regulated", "high", "pilot", "baseline"] },
          "basis": {
            "type": "array",
            "minItems": 1,
            "items": {
              "type": "object",
              "additionalProperties": false,
              "required": ["sourceId", "sourceRecordId", "url", "note"],
              "properties": {
                "sourceId": { "type": "string", "minLength": 1 },
                "sourceRecordId": { "type": "string", "minLength": 1 },
                "url": { "type": "string", "format": "uri" },
                "note": { "type": "string", "minLength": 1 }
              }
            }
          }
        }
      }
    }
  }
}
