{
  "schemaVersion": 1,
  "stateCode": "MI",
  "asOf": "2026-07-16",
  "undeterminedSpeciesPolicy": "excluded",
  "species": [
    {
      "speciesId": "dreissena-polymorpha",
      "applicability": "applicable",
      "priority": "pilot",
      "basis": [
        {
          "sourceId": "usgs-nas",
          "sourceRecordId": "dwca-v1.344:Dreissena polymorpha:MI",
          "url": "https://nas.er.usgs.gov/ipt/archive.do?r=nas&v=1.344",
          "note": "The official versioned USGS NAS archive contains Michigan occurrence rows for Dreissena polymorpha. This establishes bounded source applicability only; publication still requires the registered status, identity, and county-equivalent gates."
        }
      ]
    },
    {
      "speciesId": "myosotis-scorpioides",
      "applicability": "applicable",
      "priority": "pilot",
      "basis": [
        {
          "sourceId": "usgs-nas",
          "sourceRecordId": "dwca-v1.344:Myosotis scorpioides:MI",
          "url": "https://nas.er.usgs.gov/ipt/archive.do?r=nas&v=1.344",
          "note": "The official versioned USGS NAS archive contains Michigan occurrence rows for Myosotis scorpioides. This establishes bounded source applicability only; publication still requires the registered status, identity, and county-equivalent gates."
        }
      ]
    },
    {
      "speciesId": "nasturtium-officinale",
      "applicability": "applicable",
      "priority": "pilot",
      "basis": [
        {
          "sourceId": "usgs-nas",
          "sourceRecordId": "dwca-v1.344:Nasturtium officinale:MI",
          "url": "https://nas.er.usgs.gov/ipt/archive.do?r=nas&v=1.344",
          "note": "The official versioned USGS NAS archive contains Michigan occurrence rows for Nasturtium officinale. This establishes bounded source applicability only; publication still requires the registered status, identity, and county-equivalent gates."
        }
      ]
    },
    {
      "speciesId": "potamogeton-crispus",
      "applicability": "applicable",
      "priority": "pilot",
      "basis": [
        {
          "sourceId": "usgs-nas",
          "sourceRecordId": "dwca-v1.344:Potamogeton crispus:MI",
          "url": "https://nas.er.usgs.gov/ipt/archive.do?r=nas&v=1.344",
          "note": "The official versioned USGS NAS archive contains Michigan occurrence rows for Potamogeton crispus. This establishes bounded source applicability only; publication still requires the registered status, identity, and county-equivalent gates."
        }
      ]
    },
    {
      "speciesId": "typha-angustifolia",
      "applicability": "applicable",
      "priority": "pilot",
      "basis": [
        {
          "sourceId": "usgs-nas",
          "sourceRecordId": "dwca-v1.344:Typha angustifolia:MI",
          "url": "https://nas.er.usgs.gov/ipt/archive.do?r=nas&v=1.344",
          "note": "The official versioned USGS NAS archive contains Michigan occurrence rows for Typha angustifolia. This establishes bounded source applicability only; publication still requires the registered status, identity, and county-equivalent gates."
        }
      ]
    }
  ]
}
